{
  "$schema": "https://json-schema.org/draft/2020-12/schema",
  "$id": "https://edgegde.dev/schemas/orca-resolver-bridge/v1.0.0/orca-resolver-request.schema.json",
  "title": "OrcaResolverBridgeRequest",
  "description": "Orca Design Mode element capture request to the Hermes State Engine Resolver (FRS-005). Contract IDD-016 v1.0.0. All field names are snake_case. Enum values are snake_case.",
  "type": "object",
  "additionalProperties": false,
  "required": ["schema_version", "request_id", "captured_at", "page", "element"],
  "properties": {
    "schema_version": {
      "const": "1.0.0",
      "description": "Bridge contract version. Major version changes are breaking. The resolver MUST reject unknown versions with UNSUPPORTED_SCHEMA_VERSION."
    },
    "request_id": {
      "type": "string",
      "pattern": "^[0-9a-fA-F]{8}-[0-9a-fA-F]{4}-[0-9a-fA-F]{4}-[0-9a-fA-F]{4}-[0-9a-fA-F]{12}$",
      "description": "UUIDv4 generated by the caller. Idempotency key. The resolver caches the response for this id for 60s and replays it on retry without re-executing any action."
    },
    "captured_at": {
      "type": "string",
      "format": "date-time",
      "description": "UTC ISO-8601 timestamp of the capture, from the capturing CDP session clock."
    },
    "timeout_ms": {
      "type": "integer",
      "minimum": 1000,
      "maximum": 30000,
      "default": 10000,
      "description": "Caller-side budget for resolution plus optional action execution. The resolver returns RESOLVER_TIMEOUT when this budget is exceeded."
    },
    "page": {
      "type": "object",
      "additionalProperties": false,
      "required": ["url", "target_id", "viewport"],
      "description": "Page context the element was captured from. The resolver MUST operate on this exact target.",
      "properties": {
        "url": {
          "type": "string",
          "format": "uri",
          "description": "Document URL at capture time."
        },
        "target_id": {
          "type": "string",
          "minLength": 1,
          "description": "CDP Target.targetId of the tab that holds the element. backendDOMNodeId is only meaningful within this target."
        },
        "title": {
          "type": "string",
          "description": "Document title at capture time."
        },
        "frame_id": {
          "type": "string",
          "description": "CDP Page.frameId of the frame that owns the element. Omit for the main frame."
        },
        "viewport": {
          "type": "object",
          "additionalProperties": false,
          "required": ["width", "height"],
          "properties": {
            "width": { "type": "integer", "minimum": 1 },
            "height": { "type": "integer", "minimum": 1 }
          }
        },
        "device_pixel_ratio": {
          "type": "number",
          "minimum": 0,
          "description": "Window.devicePixelRatio at capture time."
        }
      }
    },
    "element": {
      "type": "object",
      "additionalProperties": false,
      "required": ["backend_dom_node_id", "dom_snapshot", "computed_styles", "geometry", "screenshot"],
      "description": "The captured element. Capture via CDP from the click target, including elements rendered inside Radix portals.",
      "properties": {
        "backend_dom_node_id": {
          "type": "integer",
          "minimum": 0,
          "description": "CDP DOM backendNodeId of the clicked element. Exact handle for the confidence 1.0 fast path."
        },
        "dom_snapshot": {
          "type": "object",
          "additionalProperties": false,
          "required": ["outer_html", "tag", "ancestor_path", "structural_hash", "truncated"],
          "properties": {
            "outer_html": {
              "type": "string",
              "minLength": 1,
              "maxLength": 200000,
              "description": "outerHTML of the element subtree (CDP DOM.getOuterHTML). Truncate at the last complete tag beyond 200000 chars and set truncated=true."
            },
            "tag": {
              "type": "string",
              "minLength": 1,
              "description": "Lowercase tag name of the element, e.g. button, input, div."
            },
            "attributes": {
              "type": "object",
              "additionalProperties": { "type": "string" },
              "description": "Element attributes as string key-value pairs. Include id, name, class, type, placeholder, aria-label, aria-describedby, role, href, title, data-testid when present. Omit absent attributes."
            },
            "text_content": {
              "type": "string",
              "maxLength": 2000,
              "description": "Trimmed textContent of the element."
            },
            "ancestor_path": {
              "type": "array",
              "minItems": 1,
              "maxItems": 8,
              "description": "Ancestor chain ordered nearest-ancestor-first, up to 8 entries, ending at html. Each step carries the 1-based index among same-tag siblings.",
              "items": {
                "type": "object",
                "additionalProperties": false,
                "required": ["tag", "index"],
                "properties": {
                  "tag": { "type": "string", "minLength": 1 },
                  "index": { "type": "integer", "minimum": 1 },
                  "id": { "type": "string" },
                  "classes": {
                    "type": "array",
                    "items": { "type": "string" },
                    "uniqueItems": true
                  }
                }
              }
            },
            "structural_hash": {
              "type": "string",
              "pattern": "^[a-f0-9]{64}$",
              "description": "SHA-256 hex over the canonical structural string. Canonical string = ancestor_path segments nearest-first, then the element itself, joined by '|'. Each segment = tag:index:id (id empty when absent). Example: div:3:|div:1:asset-form|html:1:|button:1:save-btn"
            },
            "child_count": {
              "type": "integer",
              "minimum": 0,
              "description": "Number of direct child elements."
            },
            "truncated": {
              "type": "boolean",
              "default": false,
              "description": "True when outer_html was truncated at the 200000 char cap."
            }
          }
        },
        "computed_styles": {
          "type": "object",
          "additionalProperties": false,
          "required": ["display", "visibility", "opacity", "pointer-events", "cursor", "color", "background-color", "font-size", "font-weight", "text-align"],
          "description": "Exact subset of CDP CSS.getComputedStyle output. Keys are kebab-case exactly as CDP returns them. Values are the raw strings.",
          "properties": {
            "display": { "type": "string" },
            "visibility": { "type": "string" },
            "opacity": { "type": "string" },
            "pointer-events": { "type": "string" },
            "cursor": { "type": "string" },
            "color": { "type": "string" },
            "background-color": { "type": "string" },
            "font-size": { "type": "string" },
            "font-weight": { "type": "string" },
            "text-align": { "type": "string" }
          }
        },
        "geometry": {
          "type": "object",
          "additionalProperties": false,
          "required": ["x", "y", "width", "height", "coordinate_space"],
          "description": "Element bounding box from CDP DOM.getBoxModel or getContentQuads, collapsed to the first quad.",
          "properties": {
            "x": { "type": "number" },
            "y": { "type": "number" },
            "width": { "type": "number", "minimum": 0 },
            "height": { "type": "number", "minimum": 0 },
            "coordinate_space": {
              "const": "viewport",
              "description": "Coordinates are CSS pixels relative to the viewport origin."
            }
          }
        },
        "portal": {
          "type": "object",
          "additionalProperties": false,
          "required": ["in_portal"],
          "description": "Portal rendering context. Elements inside Radix portals live under a portal root outside the main React tree. They still have valid backendDOMNodeIds and MUST be captured.",
          "properties": {
            "in_portal": {
              "type": "boolean",
              "description": "True when the element's nearest portal ancestor exists (e.g. under div[data-radix-portal] or document.body > div portal root)."
            },
            "portal_root_hint": {
              "type": "string",
              "description": "Selector hint for the portal root container, when in_portal is true."
            }
          }
        },
        "screenshot": {
          "type": "object",
          "additionalProperties": false,
          "required": ["storage", "mime_type", "width", "height"],
          "description": "Element screenshot reference. Use data_uri for element clips up to 4MB encoded. Use blob_ref beyond that.",
          "properties": {
            "storage": {
              "type": "string",
              "enum": ["data_uri", "blob_ref"],
              "description": "data_uri embeds the image inline. blob_ref references a blob the caller holds."
            },
            "data_uri": {
              "type": "string",
              "maxLength": 4000000,
              "description": "Data URI of the element clip. Required when storage=data_uri. Pattern: data:image/png;base64,... or data:image/jpeg;base64,..."
            },
            "blob_id": {
              "type": "string",
              "minLength": 1,
              "description": "Caller-scoped blob identifier. Required when storage=blob_ref."
            },
            "blob_url": {
              "type": "string",
              "format": "uri",
              "description": "Optional URL the resolver can use to fetch the blob when it shares the caller's origin."
            },
            "blob_expires_at": {
              "type": "string",
              "format": "date-time",
              "description": "When the blob reference stops being valid."
            },
            "mime_type": {
              "type": "string",
              "enum": ["image/png", "image/jpeg"]
            },
            "width": { "type": "integer", "minimum": 1 },
            "height": { "type": "integer", "minimum": 1 },
            "sha256": {
              "type": "string",
              "pattern": "^[a-f0-9]{64}$",
              "description": "SHA-256 hex of the raw image bytes. Enables integrity checks and dedupe."
            }
          },
          "allOf": [
            {
              "if": { "properties": { "storage": { "const": "data_uri" } }, "required": ["storage"] },
              "then": { "required": ["data_uri"] }
            },
            {
              "if": { "properties": { "storage": { "const": "blob_ref" } }, "required": ["storage"] },
              "then": { "required": ["blob_id"] }
            }
          ]
        }
      }
    },
    "action": {
      "type": "object",
      "additionalProperties": false,
      "required": ["type"],
      "description": "Optional intended operation. When present, the resolver resolves the element and the Action Engine executes the operation, then the Verification Engine confirms via state-diff. When absent, the response carries resolution and action_hints only.",
      "properties": {
        "type": {
          "type": "string",
          "enum": ["click", "fill", "type", "select", "hover"]
        },
        "value": {
          "type": "string",
          "maxLength": 100000,
          "description": "Value for fill, type, or select. Omit for click and hover."
        },
        "submit": {
          "type": "boolean",
          "default": false,
          "description": "For type: press Enter after typing."
        }
      }
    },
    "context": {
      "type": "object",
      "additionalProperties": false,
      "properties": {
        "app": {
          "type": "string",
          "description": "Application identifier, e.g. salestrekker. Used to scope known-bug registry consultation."
        },
        "locale": {
          "type": "string",
          "description": "Page locale, e.g. en-AU."
        },
        "hints": {
          "type": "object",
          "description": "Free-form caller hints. Reserved. The resolver MUST NOT treat hints as authoritative."
        }
      }
    }
  }
}
