{
  "schema_version": "1.0.0",
  "request_id": "3f6b2a1e-7c4d-4e5f-9a8b-1c2d3e4f5a6b",
  "captured_at": "2026-10-26T08:15:00.000Z",
  "timeout_ms": 10000,
  "page": {
    "url": "https://pc.v2.salestrekker.com/deals/48122/assets",
    "target_id": "A1B2C3D4E5F6A7B8C9D0",
    "title": "Add asset \u2014 Deal 48122 \u2014 Salestrekker",
    "frame_id": "F1.1",
    "viewport": {
      "width": 1440,
      "height": 900
    },
    "device_pixel_ratio": 2
  },
  "element": {
    "backend_dom_node_id": 4821,
    "dom_snapshot": {
      "outer_html": "<button type=\"button\" class=\"btn btn-primary\" id=\"save-and-calculate\" aria-label=\"Save and calculate\">Save and calculate</button>",
      "tag": "button",
      "attributes": {
        "type": "button",
        "class": "btn btn-primary",
        "id": "save-and-calculate",
        "aria-label": "Save and calculate"
      },
      "text_content": "Save and calculate",
      "ancestor_path": [
        {
          "tag": "div",
          "index": 3,
          "classes": [
            "panel",
            "panel-body"
          ]
        },
        {
          "tag": "div",
          "index": 1,
          "id": "asset-form"
        },
        {
          "tag": "body",
          "index": 1
        },
        {
          "tag": "html",
          "index": 1
        }
      ],
      "structural_hash": "377d18f8aed008ea72df2fbc25e6e0892dc63cd8b9a613890c5924fefc5f8e69",
      "child_count": 0,
      "truncated": false
    },
    "computed_styles": {
      "display": "inline-block",
      "visibility": "visible",
      "opacity": "1",
      "pointer-events": "auto",
      "cursor": "pointer",
      "color": "rgba(255, 255, 255, 1)",
      "background-color": "rgba(37, 99, 235, 1)",
      "font-size": "14px",
      "font-weight": "700",
      "text-align": "center"
    },
    "geometry": {
      "x": 640,
      "y": 812,
      "width": 168,
      "height": 40,
      "coordinate_space": "viewport"
    },
    "portal": {
      "in_portal": false
    },
    "screenshot": {
      "storage": "data_uri",
      "data_uri": "data:image/png;base64,iVBORw0KGgoAAAANSUhEUgAAAKgAAAAoCAIAAADlmSY7AAAAe0lEQVR4nO3RQQ0AIAzAwJlCAv4NIAYZe/SSE9Ck884laNYLWGF8lPFRxkcZH2V8lPFRxkcZH2V8lPFRxkcZH2V8lPFRxkcZH2V8lPFRxkcZH2V8lPFRxkcZH2V8lPFRxkcZH2V8lPFRxkcZH2V8lPFRxkcZH2V8lPFRH0+pE47HTCFRAAAAAElFTkSuQmCC",
      "mime_type": "image/png",
      "width": 168,
      "height": 40,
      "sha256": "d47ecce50ea951bc6b4c5b4c6fec510f9b4753835a956bc5fa2d90ed9dd3bfc2"
    }
  },
  "action": {
    "type": "click"
  },
  "context": {
    "app": "salestrekker",
    "locale": "en-AU",
    "hints": {
      "form_section": "assets"
    }
  }
}
